### ISSUE TITLE
Subdoc does not support mutation with setting expiry

### ISSUE THREAD

**Issue by avsej** [couchbaselabs/gocaves#85]
```
No.     Time           Source                Source Port Destination           Destination Port Protocol Length Info
    300 2.508976649    127.0.0.1             37894       127.0.0.1             37509            Couchbase 152    Subdoc Multipath Mutation Request, Opcode: 0xd1, VBucket: 0x2f3

Frame 300: 152 bytes on wire (1216 bits), 152 bytes captured (1216 bits) on interface lo, id 0
Ethernet II, Src: 00:00:00_00:00:00 (00:00:00:00:00:00), Dst: 00:00:00_00:00:00 (00:00:00:00:00:00)
Internet Protocol Version 4, Src: 127.0.0.1, Dst: 127.0.0.1
Transmission Control Protocol, Src Port: 37894, Dst Port: 37509, Seq: 724, Ack: 23628, Len: 86
Couchbase Protocol, Subdoc Multipath Mutation Request, Opcode: 0xd1, VBucket: 0x2f3
    Magic: Request (0x80)
    Opcode: Subdoc Multipath Mutation (0xd1)
    Key Length: 40
    Extras Length: 4
    Data Type: 0x00
        .... ...0 = JSON: Not set
        .... ..0. = Snappy: Not set
        .... .0.. = XATTR: Not set
    VBucket: 755 (0x02f3)
    [Value Length: 18]
    Total Body Length: 62
    Opaque: 0x0000000a
    CAS: 0x0000000000000000
    Extras
        Expiration: 10
    Key: 
        [Expert Info (Warning/Undecoded): Trailing stray characters]
        Collection ID: 0x00000000
        Collection Logical Key: subdoc_test_1118_foo_7543975.4816345461
    Mutation spec [ 0 ]
        Opcode: Subdoc Dictionary Add (0xc7)
        Subdoc flags: 0x00
            .... ...0 = MKDIR_P: Not set
            .... .0.. = XATTR_PATH: Not set
            ...0 .... = EXPAND_MACROS: Not set
            000. 0.0. = Reserved fields: 0x00
        Path Length: 4
        Value Length: 6
        Path: foo2
        Value: "bar2"

0000  00 00 00 00 00 00 00 00 00 00 00 00 08 00 45 00   ..............E.
0010  00 8a 1a c0 40 00 40 06 21 ac 7f 00 00 01 7f 00   ....@.@.!.......
0020  00 01 94 06 92 85 df c6 9b c3 6c 76 95 f8 80 18   ..........lv....
0030  02 00 fe 7e 00 00 01 01 08 0a f1 f7 9b 0f f1 f7   ...~............
0040  9b 0f 80 d1 00 28 04 00 02 f3 00 00 00 3e 0a 00   .....(.......>..
0050  00 00 00 00 00 00 00 00 00 00 00 00 00 0a 00 73   ...............s
0060  75 62 64 6f 63 5f 74 65 73 74 5f 31 31 31 38 5f   ubdoc_test_1118_
0070  66 6f 6f 5f 37 35 34 33 39 37 35 2e 34 38 31 36   foo_7543975.4816
0080  33 34 35 34 36 31 c7 00 00 04 00 00 00 06 66 6f   345461........fo
0090  6f 32 22 62 61 72 32 22                           o2"bar2"

No.     Time           Source                Source Port Destination           Destination Port Protocol Length Info
    302 2.509059670    127.0.0.1             37509       127.0.0.1             37894            Couchbase 94     Subdoc Multipath Mutation Response with flexible framing extras, Opcode: 0xd1

Frame 302: 94 bytes on wire (752 bits), 94 bytes captured (752 bits) on interface lo, id 0
Ethernet II, Src: 00:00:00_00:00:00 (00:00:00:00:00:00), Dst: 00:00:00_00:00:00 (00:00:00:00:00:00)
Internet Protocol Version 4, Src: 127.0.0.1, Dst: 127.0.0.1
Transmission Control Protocol, Src Port: 37509, Dst Port: 37894, Seq: 23628, Ack: 810, Len: 28
Couchbase Protocol, Subdoc Multipath Mutation Response with flexible framing extras, Opcode: 0xd1
    Magic: Response with flexible framing extras (0x18)
    Opcode: Subdoc Multipath Mutation (0xd1)
    Flexible Framing Extras Length: 3
    Key Length: 1
    Extras Length: 0
    Data Type: 0x00
        .... ...0 = JSON: Not set
        .... ..0. = Snappy: Not set
        .... .0.. = XATTR: Not set
    Status: Invalid arguments (0x0004)
        [Expert Info (Warning/Undecoded): Subdoc Multipath Mutation: Invalid arguments]
    [Value Length: 0]
    Total Body Length: 4
    Opaque: 0x0000000a
    CAS: 0x0000000000000000
    Flexible Framing Extras: 3
    Flexible Frame 0
        Flexible Frame ID (response): Server Recv->Send duration (0)
        Flexible Frame Len: 2
        Server Recv->Send duration: 18.6357373834953µs

0000  00 00 00 00 00 00 00 00 00 00 00 00 08 00 45 00   ..............E.
0010  00 50 09 ad 40 00 40 06 32 f9 7f 00 00 01 7f 00   .P..@.@.2.......
0020  00 01 92 85 94 06 6c 76 95 f8 df c6 9c 19 80 18   ......lv........
0030  02 00 fe 44 00 00 01 01 08 0a f1 f7 9b 10 f1 f7   ...D............
0040  9b 0f 18 d1 03 01 00 00 00 04 00 00 00 04 0a 00   ................
0050  00 00 00 00 00 00 00 00 00 00 02 00 08 00         ..............
```
